{
  "api_version": "1",
  "request_id": "x",
  "trace_id": "x",
  "status": "ok",
  "warnings": [],
  "partial_reasons": [],
  "freshness": "current",
  "data": {
    "impacted": [],
    "paths": [],
    "test_candidates": [],
    "unresolved_dynamic_calls": 0,
    "completeness": "complete",
    "evidence": []
  }
}
