{
  "api_version": "1",
  "request_id": "x",
  "trace_id": "x",
  "status": "ok",
  "data": {
    "expires_at": "x",
    "fact": {
      "id": "x",
      "kind": "working",
      "revision": "x"
    },
    "state": "open",
    "window_id": "x"
  },
  "warnings": [],
  "partial_reasons": [],
  "freshness": "current"
}
