{
  "api_version": "1",
  "request_id": "x",
  "trace_id": "x",
  "status": "ok",
  "data": {
    "block": {
      "evidence": [],
      "folded": true,
      "kind": "working",
      "language": "x",
      "redacted": true,
      "reference": {
        "id": "x",
        "kind": "working",
        "revision": "x"
      },
      "state": "x",
      "token_count": 0,
      "trust": 1,
      "version": "x"
    },
    "receipt": {
      "block": {
        "id": "x",
        "kind": "working",
        "revision": "x"
      },
      "integrity_hash": "x",
      "status": "paged_out"
    }
  },
  "warnings": [],
  "partial_reasons": [],
  "freshness": "current"
}
